<?xml version="1.0" encoding="UTF-8"?>
<Practicas xmlns:xsi="http://www.w3.org/2001/XMLSchema-instance"
    xsi:noNamespaceSchemaLocation="Practicas.xsd">
    <Alumnos>
        <Alumno nombre="José Luis Altozano">
            <NIF>58741536H</NIF>
            <Resultado>APTO</Resultado>
            <Observaciones>Cumple con los requisitos</Observaciones>
            <IP></IP>
        </Alumno>
        <Alumno nombre="Francisco Guerra">
            <NIF>58245784K</NIF>
            <Resultado>APTO</Resultado>
            <Observaciones>Ejercicio completo</Observaciones>
            <IP></IP>
        </Alumno>
        <Alumno nombre="José Canto">
            <NIF>86953114G</NIF>
            <Resultado>NO APTO</Resultado>
            <Observaciones>El esfuerzo ha sido nulo</Observaciones>
            <IP></IP>
        </Alumno>
        <Alumno nombre="Antonio de Guadalupe">
            <NIF>59631578D</NIF>
            <Resultado>APTO</Resultado>
            <Observaciones>Cumple con los requisitos</Observaciones>
            <IP></IP>
        </Alumno>
    </Alumnos>
</Practicas>